id,title,creator,link,pubdate,summary,row_no,Publisher,Category,maintext,image_url
36,"To Stay or to Go? For Older New Yorkers, Either Option Is Fraught.",Claire Wolters and Katherine Marks,https://www.nytimes.com/2025/10/21/realestate/age-in-place-new-york-city-affordable-housing.html,2025-10-21,"Older New Yorkers face significant challenges aging in place or seeking new housing, particularly in rent-stabilized units. Many prewar apartments, while offering lower rents, have maintenance deficiencies, pests, and accessibility issues, impacting residents like Maureen Gangaram's mother. A majority of older adults are rent-burdened and on fixed incomes, struggling to afford market rates. Landlord intimidation and eviction threats also push seniors out. Demand for affordable, accessible senior housing far exceeds supply; for instance, Volunteers of America-Greater New York received 26,000 applications for 84 units. This crisis contributes to a growing homeless population among seniors, emphasizing the urgent need for support and suitable housing options.",6,The New York Times,Housing Affordability,"Maureen Gangaram is tired of putting money into her mother’s apartment. A tenant in a rent-stabilized unit in Brooklyn, Ms. Gangaram moved into the prewar building full time around 2020, after her mother’s dementia worsened. Her mother, who immigrated to New York from Guyana, has lived there since 1989. At one point, Ms. Gangaram’s father worked as the building’s super. While the unit contains memories of the Gangarams’ heritage, it has also become ridden with pests, vermin and clutter — nuisances that threaten Ms. Gangaram’s health and her mother’s ability to safely age in place. “No one should be in this condition,” Ms. Gangaram, 64, said. She waved a bug-bitten forearm at a bulge in her ceiling — a battle scar from the black, rusty water that leaked through it weeks ago — and shook her head. “They’re not fixing it,” she said, referring to management. For longtime tenants like Ms. Gangaram and her mother, New York City’s rent-stabilized apartments offer financially feasible housing options for aging in place. But while those units hold some of the city’s lowest rents, not all older adults can afford to stay put because of the risks their living environments pose to their health. And even those in safe conditions may find themselves relinquishing their tenure due to pressure from management companies. Older adults occupied more than half of the city’s rent-stabilized and rent-controlled units in 2021, according to the New York City Housing and Vacancy Survey . The survey found that 21 percent of rent-stabilized apartments had three or more maintenance deficiencies, compared with only 8 percent of unregulated apartments. Linna Zhu , a senior research associate in the Housing Finance Policy Center at the Urban Institute, said that aging in place was both the most desired and least supported housing option for older adults. The challenges, she continued, were “particularly acute in places like New York City, where many older adults live in rent-stabilized or rent-controlled units.” Ms. Zhu added that rent-regulated units were commonly found in prewar buildings, which — maintenance issues aside — typically have narrow hallways, steep walk-ups and inaccessible bathrooms. Accessibility features can be limited or dilapidated, if they even exist at all. “Most apartments weren’t built for aging,” Ms. Zhu said. Yet, many adults remain in these homes. A majority of older adults in the city are rent-burdened, meaning they spend more than 30 percent of their income on rent, according to a recent report by the New York City comptroller’s office . Many are also on fixed income, meaning the gap between their monthly wages and monthly rent expenditures may exceed 30 percent. Three-quarters of New York City older adults received Social Security income in 2023, amounting to a total annual payment of under $16,500. Their monthly earnings, which amount to about $1,375, are lower than the state’s fair market rent for a one-bedroom apartment, which is $2,125 . But price isn’t the sole motivator to stay in place, either. For the Gangarams, who pay less than $1,000 in rent, their apartment connects them to their community. “Where would we go?” Ms. Gangaram said. “This is the only place we know. We came up from Guyana, we settled here. My mom worked until she was 80 years old. So, why would we want to leave?” Many older adults who leave rent-stabilized apartments don’t do so by choice, but in response to building sales, major renovation improvements or eviction. Like the rusty water in Ms. Gangaram’s unit, fear of eviction drips from the ceilings of some prewar buildings, causing tenants to turn corners or lower voices when their super enters the hall. Marcus Jackson , the manager of advocacy, community and government relations at Encore Community Services, an organization that provides housing, meals and social support to aging New Yorkers, said it was not uncommon for landlords to use intimidation tactics to weed out older adults. Lauren Carden, the director of California housing advocacy at Justice In Aging, a national organization, urges people not to automatically leave their apartments in response to an eviction notice. “Just because someone gives you a notice doesn’t mean that they fully complied with the law, and that is required before they can remove you from the unit,” she said. Mr. Jackson said he has helped older adults navigate housing challenges, such as makeshift letters forged with counterfeit stamps, illegal rent increases or cessation of maintenance. He has seen tenants go years without paint jobs, or dwell among pests, leaky faucets or malfunctioning radiators. The top barrier adults face to aging in place is “literally just keeping their place,” Mr. Jackson said. It’s “100 times harder to move someone back into a residence after they’ve already left, no matter what the circumstance may be.” So even when their electrical cords are dangling from the circuits, he continued, it can be in a tenant’s best interest to hang on. Older renters with extremely low incomes — under 30 percent of the area’s median family income — may not be able to avoid rent burden. Across the country, senior adults make up a third of renters with extremely low incomes, according to a study by the National Low Income Housing Coalition . And among seniors registered on New York City Housing Connect, a program designed to help people find affordable housing, 57 percent of them had extremely low incomes, according to a 2024 report by LiveOn NY , an advocacy group. Older renters who lack additional support may not be pushed into the new housing market so much as out of it. Nationally, older adults are the fastest growing population of homeless people , and in New York City the number of homeless adults over 65 has almost tripled over the last decade. The trends are worrisome for today’s older adults and future generations, Ms. Carden said. “The population in general of older adults is growing, so we can see down the road that this problem is going to get worse unless we take action,” she said. Bridgett Simmons, a staff lawyer at the National Housing Law Project, advises older adults to keep documentation about their apartment, which can include digital records like emails, physical communications like letters or signed leases or audio recordings of meetings or calls — if recorded legally. Such records can help protect people from unjust evictions, particularly if they are fighting their landlord in court. People may find additional support through initiatives like the city’s adult protective services, housing vouchers or the senior rent freeze program. Some older adults have successfully aged in place with help from city, state, federal and nonprofit services. Natalia Shapiro, who has lived in New York City since 1995, moved into an affordable housing unit with the nonprofit SelfHelp in 2012. Ms. Shapiro, who previously lived in a fourth-floor walk-up in Queens, said her current home was incomparable to her last. “I’m very old and need many changes in this age,” Ms. Shapiro, 87, said. “It is not easy to walk.” Now, she has the physical assistance of an elevator and the emotional support of a social worker, as well as benefits from Section 8, food stamps and medical insurance. Hannah Adjei, who moved to New York from Ghana in 2018, lived in various apartments with roommates before becoming a resident in Volunteers of America-Greater New York’s newest supportive senior housing in the Bronx this June. The building’s accessibility features, like railings and a shower chair, have helped her stay in the city, said Ms. Adjei, 64. “And no cockroaches.” Demand for these units, however, far exceeds supply. In 2021, when Volunteers of America-Greater New York opened its home in the Bronx, the group received about 26,000 applications for 84 units, said Eric Lee, the organization’s director of public policy. At Encore, the wait list for one of the organization’s buildings averages around 10 years. “It’s heartbreaking,” Mr. Lee said. “But it speaks volumes to just how desperate aging New Yorkers are to be able to find an affordable place.”",https://static01.nyt.com/images/2025/11/02/multimedia/21re-nyc-stayinplace-ext-ptqh/21re-nyc-stayinplace-ext-ptqh-superJumbo.jpg?quality=75&auto=webp
37,A Designer’s Bathroom Dipped in Yves Klein Blue,Sydney Gore and Philip Cheung,https://www.nytimes.com/2025/10/21/realestate/a-bathroom-dipped-in-yves-klein-blue.html,2025-10-21,"Jamie Lenore McKillop renovated the bathroom of her 3,000-square-foot Venice Beach home, acquired in late 2019, as it felt out of place. The three-month renovation incorporated International Klein Blue (IKB), a pigment created by artist Yves Klein. New G22 Opal Blue tiles from Heath Ceramics, inspired by IKB, replaced original ones, and the existing vanity was preserved and upgraded with Dornbracht fixtures. IKB is also central to Ms. McKillop's 2023 home décor brand, Lazy Jamie, which sells stainless steel items, including a portable TV tray table in her signature blue. She considers the bathroom her personal retreat.",10,The New York Times,Culture Led Development,"When Jamie Lenore McKillop and her husband moved to Venice Beach at the end of 2019, the couple felt as if they had secured their Los Angeles dream home. The 3,000-square-foot property straddles the line between midcentury-modern and modernist, a rarity at a time when the area’s newly developed houses look more or less the same. Ms. McKillop was adamant about keeping the original features, but the bathroom felt noticeably out of place compared with the rest of the house. Every other room had its own personality: the kitchen pistachio green with a cherry red hidden bar cabinet; a bedroom in butter yellow; and the exposed stairs in the ceiling above the kitchen sink where her cat perches and plays peek-a-boo. “I wanted to find a way to keep the integrity and the character, but do something that felt more current, but also a bit more of a statement,” she said. During the three-month renovation, Ms. McKillop became obsessed with International Klein Blue , the dynamic pigment created by the French artist Yves Klein in 1961. In addition to being the new backdrop for her bathroom tiles, this specific shade has become an integral part of the identity for Lazy Jamie , a home décor brand Ms. McKillop founded in 2023. She sells a variety of stainless steel home wares, the latest being a portable TV tray table with a mirror chrome tubular steel base and high-gloss wood top in her signature color. “Yves Klein said that blue was limitless,” Ms. McKillop said. “I want to challenge how people experience rest through furniture, so the definition of blue acting as a kind of freedom and as an antidote to restrictive limits really resonates with me. I hope to subvert the idea of laziness to be positive.” So while Gen Z is busy bed rotting , Ms. McKillop, 33, prefers losing track of time in the bathroom. “The bathroom is my favorite because I can lock the door and don’t have to worry about anyone coming in,” she said. “It’s not just a bathroom; it’s a dressing room, a makeshift spa, and sometimes an office. It’s my retreat.” Ms. McKillop shared a few essential pieces that have elevated her bathroom experience. A TV tray, Ms. McKillop said, can be an “unexpected furniture piece for your most in-between moment,” whether that takes place in the living room, bedroom or bathroom. “It’s this moment of joy that none of us really talk about, but we all share,” she said. “It feels so good, when my partner’s out of town, or when I’m alone, and that’s what I’m doing — I’m not eating in silence at a dining table.” Inspired by her grandmother and the trays around her house, Ms. McKillop reimagined a version with this generation in mind. Unsurprisingly, she wanted to “bring in the blue in a really prominent way,” so the removable butler tray is powder-coated in International Klein Blue or off-white for fans of neutral palettes . She emphasized that the table was designed for solo activities in smaller spaces rather than as part of a set for an entire household. The designer uses it in a variety of ways, including as a desk while working from her bed, a platform for watching movies in the bathtub, or “an ultra chic tampon holder” next to the toilet, she said. “When I was in my 20s and had roommates we would eat in front of the TV, we wouldn’t sit at the dining table,” she said. “More of us than ever are living in small spaces and eating in front of the TV because oftentimes we’re ordering takeout and watching Netflix. Our culture is much more set up for that moment than they are the Norman Rockwell idea of eating dinner.” While many of the fixtures desperately needed to be replaced, Ms. McKillop insisted that the driving force behind the bathroom renovation was color not cosmetics. Since the original tiles, which were a “very ’90s blue,” needed to be ripped out regardless, Ms. McKillop thought it would be fun to update them with a hue that felt more current. While searching for International Klein Blue ceramic subway tiles online, she was led to the G22 Opal Blue Tile from Heath Ceramics, which has stores in California and Texas. “Now that I feel like I’ve become more entrenched in this Yves Klein Blue world, I’ve researched more about the blue, why people are drawn to it and his beliefs around it,” she said. “It’s hard to define, but it’s sort of this ultramarine. He has said that it has no dimensions, it’s kind of limitless and it represents freedom — that’s why when you look at it, it has that calming, relaxing quality.” Ms. McKillop is so fond of the tiles that she has a matching ceramic mug and bowl for a pleasing “pop of blue” on her table, too. A good vanity is hard to find these days, so Ms. McKillop was willing to do whatever was necessary in order to preserve the original piece in her bathroom. She sanded down and polished the stone countertop, and then upgraded the outdated fixtures with ones from Dornbracht . Her followers on TikTok and Instagram continue to leave comments saying how beautiful the contrast is between the orange-tinted rosewood and deep blue tiles. “When you have the sunlight coming in, it definitely creates more of that contrast and it really pops,” she said. “Unfortunately, because it’s vintage at this point, it is one of a kind. You can’t buy it, but someone should make it.”",https://static01.nyt.com/images/2025/09/30/multimedia/30re-designfinds-mckillop-02-mtkc/30re-designfinds-mckillop-02-mtkc-superJumbo.jpg?quality=75&auto=webp
38,He Left the City for a Cat in Brooklyn,D.W. Gibson,https://www.nytimes.com/2025/10/20/realestate/new-york-rental-gowanus.html,2025-10-20,"Dimitrios Petsas, 55, a Vice President at Estée Lauder, moved from downtown Manhattan to Gowanus, Brooklyn, in March, because of his cat, Lucy. Petsas, a longtime downtown resident, adopted Lucy, a malnourished kitten, in Athens in 2023. After falling in love with Lucy, he needed an apartment with a separate room to get sleep, as his open-plan downtown home did not suit them. Unable to find a suitable downtown unit, and noting downtown Manhattan's post-pandemic changes, he found a $5350 rental in Gowanus. He liked the design of the unit at 655 Union and the neighborhood's ""grit"" reminiscent of 90s TriBeCa. Petsas and Lucy are now settled.",7,The New York Times,Housing Affordability,"Dimitrios Petsas’s love for downtown Manhattan ran so deep he couldn’t bring himself to leave. “I never lived above Bleecker,” he said. “I took great pride in it — and I can actually recite all of my apartments.” There was Murray Street and William Street, two different apartments on 80 John Street and the place in Tribeca Tower. “That was when 9/11 happened,” said Mr. Petsas, 55. “I lived on the 49th floor, so I saw everything.” It was the mid-90s version of TriBeCa that he really loved. “It was no man’s land. No tourists. I would go rollerblading at night, it was amazing.” Over the years, Mr. Petsas periodically left New York, always instigated by work, for short stints in other cities — Los Angeles, Houston, Singapore, Tokyo, London. “I’ve been in New York on and off all my life, mostly on. And friends make fun of me because they say I’m a creature of habit, which I am. I find a restaurant and never switch. But I don’t have a problem just picking up and moving countries.” With each return to New York, he renewed his allegiance to the same quaint radius of downtown Manhattan. That is, until Lucy came into his life. $5350 | Gowanus Occupation: Vice President of Global Brand Voice at Estée Lauder On professional fidelity: Mr. Petsas’s long career in advertising not only spans across cities but also several agencies. “I started out at Ogilvy but I worked at a number of places — McCann, Grey, Leo Burnett, Deutsch, Saatchi & Saatchi,” he said. “I like to joke that there were no other agencies to sleep with, so I moved on to the brand side.” He joined Estée Lauder in 2022. On long-distance relationships: Mr. Petsas’s husband, Hiro Takata, works as a United Nations diplomat and moves from post to post, all around the world, with little time in New York. Next stop: Abidjan, Ivory Coast. But the couple make a point to see each other every four to six weeks with daily video calls sustaining them between reunions. “There are definitely moments of loneliness,” Mr. Petsas said. “But it’s a lifestyle that suits us. We’re both very self-sufficient and independent.” He met Lucy on a trip to his hometown, Athens, in 2023. “I was walking with my sister,” he said, “and we saw something and thought it was a rag on the ground. We realized it was a kitten. We almost stepped on her.” Mr. Petsas picked up the malnourished animal and took her to a veterinarian. “Immediately the vet said, ‘I don’t know if she’s going to make it.’ She was almost dead.” Initially Mr. Petsas’s sister brought Lucy to live with her. She was the one who named the feline in honor of Lucille Ball. “It was because she was funny and expressive,” Mr. Petsas said. “And somewhat of a klutz for a cat.” But his sister soon discovered that her partner was allergic to cats. So, Mr. Petsas stepped in. “I said, ‘All right, I’ll find her another home.’” A few days later, Mr. Petsas was flying back to New York with Lucy. “That was not the easiest part of my life,” he said. “She was not a good traveler. She might have been blacklisted on United Airlines. She crawled out of her carrier, passengers on other planes could hear her. She was so loud, it was comical. But we made it.” Mr. Petsas’s plan to find another home for the feline was soon abandoned. “Of course, I fell in love with her,” he said, “so she ended up staying.” There was just one problem. “It was a very quirky living situation because my apartment was a big open space, and she kept waking me up in the morning. I just couldn’t do it anymore.” He knew he needed to find a new place — somewhere with a door that he could close at night — and he started looking for a suitable one-bedroom in his building. Nothing came up. He branched out to other buildings in the neighborhood but wasn’t having luck. Everything was either too small or too expensive. He looked for a couple of weeks. Early mornings brought the zoomies for Lucy and sleeplessness for Mr. Petsas. Then one day an ad caught his eye: rentals in a building in the Gowanus neighborhood of Brooklyn. “I said to myself, ‘Well, why not?’” It was a big decision but the passage of time had made it an easy decision. “I think one of the reasons was because after the pandemic, the neighborhood had changed so much,” Mr. Petsas said of downtown Manhattan. “It had become more crowded and a lot more impersonal. It had lost a lot of its texture and color and I was missing that.” So he made an appointment to look at a unit he’d seen in the ad. “I liked the neighborhood but I was not that crazy about the building.” On his way home, 655 Union had caught his eye. “I’m very lazy, so I liked the fact that it was right next to the R train station,” he said. He came back the next day to look at a couple of units. “I liked how much thought had gone behind the design,” he said. “There was a finesse to it. Also, I am very spoiled, having lived in Japan and Singapore, where everything is just insanely pristine. I was kind of chasing that and it usually does not exist in New York, no matter how much you pay.” Gowanus also made him feel right at home; it reminded him of what TriBeCa was like in the 1990s. “It has a little bit of grit, a little bit of color. Right across the street from me there are auto body shops and there’s graffiti. I do enjoy that.” Mr. Petsas and Lucy moved into the building in March. The beginning was challenging. “She was a little unhappy with the closed door the first couple of nights,” he said. “There was a little bit of meowing, a little bit of scratching on the door, but then she was fine.” Now they’re both comfortable. “I’m happier just having my own room and having my nine hours of sleep every night,” he said. “And she’s just very happy to see me in the morning.”",https://static01.nyt.com/images/2025/10/20/multimedia/20re-renters-petsas-gkcp/20re-renters-petsas-gkcp-superJumbo.jpg?quality=75&auto=webp
